pica-pau-de-cabeca-amarela;Celeus flavescens;(Gmelin, 1788);Blond-crested Woodpecker;Pouco Preocupante;Mede entre 27 e 30 centímetros de comprimento e pesa entre 110 e 165 gramas.;"Alimenta-se de insetos, suas larvas e ovos, formigas e cupins nas árvores ou no solo e de uma grande variedade de frutas e bagas. Foi documentado tomando néctar de flores em duas espécies de plantas do dossel, Spirotheca passifloroides (Bombacaceae) e Schwartzia brasiliensis (Marcgraviaceae), em Mata Atlântica do sudeste do Brasil. Spirotheca passifloroides floresce por três meses no inverno, ao passo que S. brasiliensis floresce ao longo de dois meses no verão. As flores de ambas as espécies produzem néctar abundante e diluído. Visita várias flores por planta, tocando as anteras e os estigmas com a cabeça e o pescoço, assim agindo como polinizador (Rocca et al; 2006).";;O pica-pau-de-cabeça-amarela (Celeus flavescens) é uma ave da ordem dos Piciformes, da família Picidae.;;Também conhecida como cabeça-de-velho, joão-velho, pica-pau-amarelo, pica-pau-loiro, pica-pau-velho e pica-pau-cabeça-de-fogo. Destaca-se pelo vistoso topete amarelo que dá origem à maior parte de seus nomes populares.;"Seu nome científico significa: do (grego) keleus = pica-pau verde; e do (latim) flavus, flavescens = amarelo, que vem do ouro, dourado. ⇒ Pica-pau com crista amarela - (Latham, 1782).";;"Cabeça e face amarelos, com proeminente topete da mesma cor; macho com faixa malar vermelha. Partes superiores pretas, barradas de branco e partes inferiores uniformemente pretas.";;;;Possui duas subespécies reconhecidas:;;;;;;;;pica-pau-de-cabeça-amarela se alimentando;Constrói seu ninho em cavidades escavadas em formigueiros arborícolas e em árvores secas, onde põe 2 a 4 ovos brancos e brilhantes. O macho incuba e cuida dos filhotes também.;Vive na Mata Atlântica, matas mesófilas, matas secas, matas de araucária, matas de galeria, caatinga, cerrados, eucaliptais, parques e zonas rurais arborizadas. Encontrado geralmente em casais ou em grupos familiares de 3 a 4 indivíduos.;"Vocalização: Frequência fortemente descendente e ressonante, com as sílabas bem pronunciadas e destacadas “(tzü tzü tzü tzü)” ( canto territorial ); “tttrrr” (raiva). Tamborila em seqüência rápida.";Ocorre da margem setentrional do baixo Amazonas ao Rio Grande do Sul, Paraguai e Argentina (Misiones).;;;;;;;;;;;;;;;;;;;;;;;;;;;;;;;;;;;;;;;;;;;;;;;;;;;;;;;;;;;;;;;;;;;;;;;;;;;;;;;;;;;;;;;;;;;;;;;;;;;
pica-pau-de-banda-branca;Dryocopus lineatus;(Linnaeus, 1766);Lineated Woodpecker;Pouco Preocupante;Mede cerca de 33 centímetros de comprimento, com topete e estria malar vermelhos, asas, peito superior e lados da cabeça pretos, faixa branca que se estende do bico às laterais do peito, garganta manchada, mácula escapular branca e barriga branca barrada de preto.;Alimentam-se de insetos, larvas, sementes e frutos. Sua alimentação é principalmente a base de insetos, especialmente brocas da madeira. Para encontrar a galeria vai dando batidas curtas na madeira até delimitar o final do túnel escavado pela larva. Nesse ponto, começa a dar fortes pancadas inclinadas, retirando lascas grandes da madeira até chegar ao canal. Retira a larva usando a longa língua, pegajosa e com cerdas na ponta, parecendo uma flecha. Procura formigas (Azteca sp.), seus ovos e pupas, perfurando galhos de embaúba (Cecropia sp.). Gosta também de frutas, como o abacate.;;O pica-pau-de-banda-branca é uma ave piciforme da família Picidae. Também conhecido com pica-pau-de-topete-vermelho.;;"Seu nome científico significa: do (grego) drus = árvore, madeira; e kopos = bater, batida; druokopos = pica-pau; e do (latim) lineatum, lineatus = com linhas, listrado. ⇒ Pica-pau listrado.";;"O macho apresenta a região anterior da cabeça e uma faixa próxima ao bico de cor vermelha; a fêmea possui a região anterior da cabeça preta e não tem a faixa vermelha. Na subespécie Dryocopus lineatus erythrops pode faltar a mancha branca escapular.";pica-pau-de-banda-branca macho;pica-pau-de-banda-branca fêmea;pica-pau-de-banda-branca jovem;Possui cinco subespécies reconhecidas e duas delas ocorrem no Brasil:;;;;;;;;;;;;pica-pau-de-banda-branca se alimentando;Vive em pares ou em grupos familiares, com o macho e a fêmea tamborilando em sequência longa e baixa. Na época de reprodução, ele escava um buraco em uma árvore da borda da mata ciliar, voltando para a abertura. Dessa maneira, pode entrar e sair sem ser atrapalhado por galhos. As fêmeas desta espécie de pica-pau põem em média de 2 a 3 ovos, e o macho participa dos cuidados com a prole.;"Habita o interior e as bordas de florestas altas, capoeiras, cerrados, campos e plantações com árvores esparsas. Vive solitário ou aos pares, arrancando a casca e “martelando” troncos e galhos maiores em busca de insetos, tanto em árvores vivas como mortas. Dormem sempre em ocos, onde também se abrigam da chuva pesada; alguns elaboram cavidades que servem para dormir. Recolhem-se cedo para dormir.";"Voz: Sequência prolongada de fortes e sonoros “wet…” ( canto territorial, ambos os sexos ); sonoro”bet-wärrr”,”gí-gogogo”, “bé-be-be-qua” ( advertência ). Tamborilar prolongado “torrrrrrrr” ( ambos os sexos ). Pela manhã, costumam demarcar seus territórios com característico tamborilar. Escolhem uma árvore ou galho oco e dão sua batida peculiar. Começam com uma pancada alta, separada das demais e vão diminuindo o intervalo e a altura da batida, produzindo uma aceleração no final.";Bando de pica-pau-de-banda-branca;Presente em todo o Brasil e também do México à Bolívia, Paraguai e Argentina.;Status de conservação: LC ( IUCN ).;;;;;;;;;;;;;;;;;;;;;;;;;;;;;;;;;;;;;;;;;;;;;;;;;;;;;;;;;;;;;;;;;;;;;;;;;;;;;;;;;;;;;;;;;;;;;;
carcara;Caracara plancus;(Miller, 1777);Southern Caracara;Pouco Preocupante;"Medindo cerca de 50-60 centímetros da cabeça a cauda, o peso do macho é de 834 g; a fêmea pesa 953 g e mede cerca de 123 centímetros de envergadura; o carcará é facilmente reconhecível quando pousado, pelo fato de possuir uma espécie de solidéu preto sobre a cabeça, assim como um bico adunco e alto, que assemelha-se à lâmina de um cutelo; a face é vermelha. É recoberto de preto na parte superior e possui o peito de uma combinação de marrom claro com riscas pretas, de tipo “carijó”; patas compridas e de cor amarela; em voo, assemelha-se a um urubu, mas é reconhecível por duas manchas de cor clara na extremidade das asas. Deve seu nome à vocalização que emite. O peso varia de 786-953 gramas.";"Não é um predador especializado, e sim um generalista e oportunista, assim como o seu parente próximo, o carrapateiro (Milvago chimachima). Onívoro, alimenta-se de quase tudo o que acha, de animais vivos ou mortos até o lixo produzido pelos humanos, tanto nas áreas rurais quanto urbanas. Adaptou-se à presença humana, comendo restos de comida no lixo das casas ou as vísceras de peixe nos acampamentos de pescadores (Antas, 2005; Sick, 1997). Suas estratégias para obtenção de alimento são variadas: caça lagartos, cobras, sapinhos e caramujos; rouba filhotes de outras aves, até de espécies grandes como garças, colhereiros e tuiuiús (Jabiru mycteria); arranha o solo com os pés em busca de amendoim e feijão; apanha frutos de dendê; ataca filhotes recém-nascidos de cordeiros e outros animais. Também segue tratores que estão arando os campos, em busca de minhocas e larvas ou pequenos vertebrados, como anfíbios Leptodactylus fuscus (Crozariol & Gomes 2009). É muito comum ser avistado ao longo das rodovias para alimentar-se dos animais atropelados. Fica nas proximidades dos ninhais para comer restos de comida caídos no chão, ovos ou filhotes deixados sem a presença dos pais. Chega a reunir-se a outros carcarás para matar uma presa maior. É também uma ave comedora de carniça e é comumente visto voando ou pousado junto a urubus pacificamente, principalmente ao longo de rodovias ou nas proximidades de aterros sanitários e locais de depósito de lixo. Dois hábitos pouco conhecidos são a caça de crustáceos nos manguezais (seja entrando na água para abocanhar os que estão perto, ou percorrendo o mangue a pé, na maré baixa) e a pirataria (o fato de perseguir gaivotas e águias-pescadoras (Pandion haliaetus), forçando-as a deixar a presa cair, que apanha em voo).";;Também conhecido como caracará, carancho, caracaraí (Ilha do Marajó), gavião-de-queimada e gavião-calçudo. O carcará não é taxonomicamente uma águia, e sim um parente distante dos falcões. É tanto visto sozinho como em bandos numerosos em redor de mamíferos e carcaças. Ocorre em campos abertos, cerrados, borda de matas e inclusive centros urbanos de grandes cidades.;;;;;;;;;;;;;;;;"Seu nome científico significa: do (tupy) caracará = onomatopeia indígena para o som emitido por esta ave da família Falconidae; e do (latim) plancus, plangos = águia. ⇒ Águia que emite o som “cará”, “cará”.";;Para melhor identificação desta ave em voo, basta perceber que sua asa é mais estreita (fina) do que a de um urubu, e a cauda também mais longa.;;;;Espécie monotípica (não são reconhecidas subespécies).;;Caracara plancus alimentando-se de Ramphastos toco (tucanuçu);"Constrói um ninho com galhos em bainhas de folhas de palmeiras ou em outras árvores. Usa ninho de outras aves também. A postura do carcará é composta de dois ou três ovos, sendo raro encontrar um quarto ovo. A coloração dos ovos está entre o branco e o castanho avermelhado, podendo variar nas tonalidades existentes entre essas cores. Os ovos possuem manchas vermelhas ou castanhas e medem cerca de 56 a 61 mm de comprimento por 44 a 47 mm de largura. A incubação dura cerca de 28 dias e é feita por ambos os pais. O filhote sai do ninho por volta do terceiro mês de vida, mas continua demandando os cuidados dos pais por mais algum tempo. Segundo (Antas, 2005; Sick, 1997) os pais criam somente um filhote por temporada.";"Vive solitário, aos pares ou em grupos, beneficiando-se da conversão da floresta em áreas de pastagem, como aconteceu no leste do Pará. Pousa em árvores ou cercas, sendo frequentemente observado no chão, junto a queimadas e ao longo de estradas. Passa muito tempo no chão, ajudado pelas suas longas patas adaptadas à marcha, mas é também um excelente voador e planador; costuma acompanhar as correntes de ar ascendentes. Durante a noite ou nas horas mais quentes do dia, costuma ficar pousado nos galhos mais altos, sob a copa de árvores isoladas ou nas matas ribeirinhas.";Para avisar os outros carcarás de seu território ou comunicação entre o casal, possui um chamado que origina o seu nome comum, “carcará”. Nesse chamado, dobra o pescoço e mantém a cabeça sobre as costas, enquanto emite o som (algumas espécies de aves de rapina têm o mesmo habito de dobrar o pescoço para trás quando emitem som). É visto com frequência em áreas urbanas.;Bando de carcará;Allopreening: comportamento social onde indivíduos de determinada espécie executam a limpeza em outro indivíduo pertencente ao seu grupo social.;Os motivos mais aceitos para este comportamento são remoção de ectoparasitos, posicionamento hierárquico e restabelecimento do bom convívio.;O Allopreening entre duas espécies de famílias diferentes (Cathartidae e Falconidae), uma necrófaga e a outra predadora, torna o entendimento deste comportamento, além de difícil, ainda mais belo. Muitas vezes incluem-se em bandos de urubus (principalmente urubus-de-cabeça-preta), compartilhando o alimento.;Allopreening entre espécies diferentes;Allopreening na mesma espécie;carcará (Caracara plancus);Possui uma distribuição geográfica ampla, que vai da Argentina até o sul dos Estados Unidos, ocupando toda uma variedade de ecossistemas, fora a cordilheira dos Andes. Sua maior população se encontra no sudeste e nordeste do Brasil.;  Ocorrências registradas no WikiAves;Carvalho, C. E. A. & Marini, M. Â. 2007. Distribution patterns of diurnal raptors in open and forested habitats in south-eastern Brazil and the effects of urbanization. Bird Conservation International 17: 367-380.S.O.S. Falconiformes;Crozariol, M.A. & F.B.R. Gomes (2009) Predação de Leptodactylus fuscus (Schneider, 1799) (Anura: Leptodactylidae) por Caracara plancus (Miller, 1777) (Aves: Falconidae), com notas sobre história natural, no Vale do Paraíba do Sul, SP. Atualidades Ornitológicas 149: 4-5.;Marini, M.Â., Aguilar, T. M., Andrade, R. D., Leite, L. O., Anciães, M., Carvalho, C. E. A., Duca, C., Maldonado-Coelho, M., Sebaio, F. & Gonçalves, J. F. 2007. Biologia da nidificação de aves do sudeste de Minas Gerais, Brasil. Revista Brasileira de Ornitologia 15:1-10. S.O.S. Falconiformes;Antas, P.T.Z. Aves do Pantanal. RPPN. Sesc:2005.;Aves de Rapina do Brasil - disponível em http://www.avesderapinabrasil.com;Portal Brasil 500 pássaros, Caracará. Disponível em: http://webserver.eln.gov.br/Pass500/BIRDS/1eye.htm. Acessado em 01 mai. 2009.;;;;;;;;;;;;;;;;;;;;;;;;;;;;;;;;;;;;;;;;;;;;;;;;;;;;;;;;;;;;;;;;;;;;;;;;;;;;;;
carrapateiro;Milvago chimachima;(Vieillot, 1816);Yellow-headed Caracara;Pouco Preocupante;Mede entre 36 e 45 centímetros de comprimento, o peso do macho varia entre 277 e 335 gramas e o da fêmea varia entre 307 e 364 gramas. Sua envergadura atinge 74 centímetros. Cabeça e corpo branco-amarelado, dorso marrom-escuro, lista pós ocular preta, asas longas com mancha branca perceptível quando em voo. A cauda é longa com larga banda terminal marrom escura.;Alimenta-se principalmente dos parasitas de bovinos e equinos tais como carrapatos. Quando não encontra carrapatos, seu prato principal, alimenta-se de lagartas e cupins, saqueia ninhos, alimenta-se de carniça, frutas e outras opções. Em remanescentes florestais preda parasitas de herbívoros de grande porte, como a anta e os veados. Mas esses animais não são encontrados com facilidade, nem em grande número, assim, pode-se dizer que é uma das poucas espécies que se beneficiam do desmatamento para a formação de pastos e criação de grandes rebanhos, pois encontra vasta quantidade de carrapatos. Nas regiões litorâneas se alimenta de peixes acostados pelas marés, conforme observado na Ilha do Mel.;;O carrapateiro é uma ave falconiforme da família Falconidae. É um dos gaviões mais conhecidos do Brasil. Também é conhecido pelos nomes de caracará-branco, caracaraí, caracaratinga, carapinhé, chimango, gavião-pinhé, papa-bicheira, pinhé, pinhém, chimango-branco, chimango-carrapateiro, chimango-do-campo e gavião-carrapateiro. É encontrado em todo o Brasil.;;"Seu nome científico significa: do (latim) milvus = falcão; e -ago = anterior, semelhante; e chimachima = onomatopeia argentina para o som emitido pelo caracará. (Azara (1802-1805) (Milvago). ⇒ Falcão semelhante ao caracará.";;O dimorfismo sexual se apresenta numa área entre os olhos e o bico, onde o macho possui a pele nua com uma cor amarelo-alaranjada, na fêmea esta pele é de coloração rosa-pálido.;;;;Possui duas subespécies reconhecidas:;;;;;;;;carrapateiro se alimentando;pomba-galega;Constrói grandes ninhos, de ramos secos, em palmeiras ou em outras árvores. Os ovos, de 5 a 7, são redondos, pardo-amarelos com manchas pardo-vermelhas. A fêmea encarrega-se da incubação e o macho fornece-lhe o alimento durante tal período. A incubação dos ovos dura de 21 a 23 dias. Após o nascimento dos filhotes o macho continua a alimentar a fêmea e esta, por sua vez, os jovens.;O carrapateiro é frequentemente encontrado nas fazendas de gado, com o qual vive associado, retirando carrapatos destes. Frequentemente é encontrado retirando carrapatos de capivaras (Hydrochoerus hydrochaeris), pois estes animais, por viverem grande parte do tempo no meio aquático para proteção, acabam se tornando hospedeiros de grandes quantidades de carrapatos. Habita pastagens, campos com árvores esparsas, vizinhanças de cidades e margens de rodovias. Quando em sobrevoo, emite um grito agudo que soa como “pinhé” (som que é suficiente para identificá-lo), semelhante ao canto do gavião-carijó (Rupornis magnirostris). É muito visto em áreas urbanas.;Ocorre da América Central ao norte do Uruguai e da Argentina e em todo o território brasileiro.;;;;;;;;;;;;;;;;;;;;;;;;;;;;;;;;;;;;;;;;;;;;;;;;;;;;;;;;;;;;;;;;;;;;;;;;;;;;;;;;;;;;;;;;;;;;;;;;;;;;
falcao-relogio;Micrastur semitorquatus;(Vieillot, 1817);Collared Forest-Falcon;Pouco Preocupante;Devido a seu porte (mede entre 46 e 56 centímetros de comprimento), é surpreendente como é de difícil observação. Macho e fêmea são idênticos, esta um pouco maior. A cor da plumagem varia entre indivíduos, havendo exemplares completamente negros, com algumas listras laterais claras na barriga. A plumagem mais característica é negra nas costas, parte superior do pescoço e alto da cabeça. As partes inferiores são brancas ou avermelhadas, com um colar da mesma cor na garganta, estendendo-se pela nuca. Logo abaixo dos olhos (muito grandes e escuros), há uma área da mesma cor da garganta. Entre essa região e o colar nucal, existe uma faixa negra, estreita e ligada ao alto da cabeça. Em qualquer plumagem, a longa cauda é negra, com 4 finas listras brancas, muito separadas entre si. As pernas são longas, amarelas, enquanto a pele nua das narinas é esverdeada e conectada à pele nua e proeminente ao redor dos olhos.;Exímio caçador de outras aves, algumas bem maiores em tamanho e peso, apanha também pequenos mamíferos, cobras e lagartos. Os grandes olhos auxiliam nas caçadas dentro da mata e em horário de pouca luz, podendo usar sua audição aguçada para localizar a presa. Foi observada uma tática pouco usual na caça de aves. Pousado próximo a uma correição de formigas (as quais atraem aves para apanhar os insetos espantados), emitia um chamado baixo, em um galho a 1 ou 2 metros do solo. Esse chamado, com características ventríloquas, atraia as aves para o raio de ação do falcão-relógio.;;O falcão-relógio é uma ave falconiforme da família Falconidae.;;"Seu nome científico significa: do (grego) mikros = pequeno; e astur = açor, milhafre, referente ao gênero Astur de Lacépède, (1799); e do (latim) semi = pequeno, meio, metade; e torquatus, torque = com colar, colar. ⇒ Pequeno milhafre com pequeno colar. “Esparvero faxado” de Azara (1802–1805) (Micrastur).";;;;Possui duas subespécies reconhecidas:;"Micrastur semitorquatus semitorquatus (Vieillot, 1817) - ocorre na floresta tropical do norte da América do Sul até o Brasil e no norte da Argentina;";Micrastur semitorquatus naso (Lesson, 1842) - ocorre da região norte do México até o Equador e extremo noroeste do Peru.;;;;Botam de dois a três ovos com um período de incubação de 46 dias. Geralmente os ninhos são feitos dentro de cavidades, em árvores ocas, com múltiplas entradas, a uma altura entre 12 e 20 m do solo. O ninho e seus arredores são constantemente vigiados pela fêmea que impede a aproximação de outras aves e primatas. Os filhotes abandonam o ninho com 46 - 50 dias.;falcão-relógio (Micrastur semitorquatus);É um falconídeo florestal, habita o interior da mata, raramente observado nas bordas.;Em geral, é mais escutado do que visto. Canta ao clarear ou ao escurecer (as vezes durante a noite), um chamado grave, transcrito com “ao”, sendo seus cantos bem pontuais. Essa é a razão do nome comum, devido à constância do intervalo entre os chamados.Além disso, quando pousado, balança a cauda lentamente e lateralmente como um pêndulo de relógio.;Ocorre do México a América do Sul.;;;;;;;;;;;;;;;;;;;;;;;;;;;;;;;;;;;;;;;;;;;;;;;;;;;;;;;;;;;;;;;;;;;;;;;;;;;;;;;;;;;;;;;;;;;;;;;;;;;;;;;;
falcao-de-coleira;Falco femoralis;Temminck, 1822;Aplomado Falcon;Pouco Preocupante;Ambos os sexos são semelhantes, sendo que a fêmea é maior do que o macho. O macho mede entre 35 e 38 centímetros e pesa entre 208 e 305 gramas. A fêmea mede entre 43 e 45 centímetros e pesa entre 271 e 460 gramas. Espécie esbelta, de asas e cauda bastante longas. A cabeça, testa, coroa nuca e manto são cinza ardósia com as bordas das penas brancas. Bochechas e garganta são brancas, separados por uma listra malar escura. Possui largas faixas supra-oculares brancas ligando-se na nuca onde sua coloração torna-se amareladas e abaixo, uma faixa cinza-ardósia terminando nas laterais da cabeça. A cauda é escura, finamente barrada com cinco faixas brancas e faixa terminal branca. Na asa aberta nota-se orla posterior nitidamente esbranquiçada, secundárias com larga ponta branca, o que é bem pronunciado em voo. As penas rêmiges são enegrecidas. Nas partes inferiores apresenta peito branco e o ventre escuro apresenta fino barrado com as penas apresentando as margens ou bordas brancas. O crisso e os calções são castanhos. O bico é cinza escuro com cere amarelo. Os olhos são marrom escuro com anel periocular amarelo. Tarsos e pés também são amarelados.;Caça rente ao solo em campos e restingas. Às vezes peneira. Come insetos, também cupins em revoada, lagartixas, morcegos e ocasionalmente pássaros e até cobras peçonhentas como a jararaca. Aparece nas grandes queimadas, onde pousa em árvores à frente do fogo para localizar presas.;;O falcão-de-coleira é uma ave falconiforme da família Falconidae.;;Também conhecido como cauré, gavião-de-coleira e gavião-pombo (São Paulo).;"Seu nome científico significa: do (latim) falco com origem no (grego) phalkön = falcão; e do (latim) femoralis, femoral, femur = cobertura para a coxa, fêmur. ⇒ Falcão com cobertura na coxa.";;O imaturo apresenta as partes superiores na cor castanho escuro com o peito manchado e sobrancelha mais clara.;;;;Possui três subespécies reconhecidas:;;;;;falcão-de-coleira se alimentando;* Notas de observação pessoal (Alexandre Faitarone – Jaguariúna-SP - Maio/2011).;Estes rapinantes costumam caçar em pares e utilizam poleiros altos como este para terem uma visão privilegiada.;Típico poleiro de caça;Ao avistar uma presa em potencial (geralmente pombas/rolinhas), um deles faz a primeira investida enquanto segundos depois o outro sai, alternando os mergulhos sobre a presa. Muito bonito de se ver.;Não constroem ninhos, pois ocupam os já feitos por outras aves. Os ovos costumam ser densamente manchados, mas podem ser marrons quase uniformes. A postura dos ovos, que são em média 3, tem início entre agosto e setembro. A fêmea é encarregada da incubação e, após a eclosão, esta cuida dos filhotes enquanto o macho sai em busca de alimento.;Espécie campestre, ocorre em campos, cerrados, cerradões e até áreas urbanas.;Ocorre dos Estados Unidos à Terra do Fogo, todo o Brasil.;  Ocorrências registradas no WikiAves;Native Alimentos - disponível em http://www.nativealimentos.com.br/biodiversidade/especies_det.php?id=79 Acesso em 03 jun. 2009.;CEO - dicionário de nomes populares - disponível em www.ceo.org.br Acesso em 03 jun. 2009.;"CLEMENTS, J. F., T. S. Schulenberg, M. J. Iliff, D. Roberson, T. A. Fredericks, B. L. Sullivan, and C. L.. The Clements checklist of Birds of the World: Version 6.9; Cornell: Cornell University Press, 2014.";"The World Bird Database, AVIBASE; http://avibase.bsc-eoc.org/species.jsp?avibaseid=5EC5BE3F4FBC07F2";Handbook of the Birds of the World Alive. Lynx Edicions, Barcelona.;"ITIS - Integrated Taxonomic Information System (2015); Smithsonian Institution; Washington, DC.";;;;;;;;;;;;;;;;;;;;;;;;;;;;;;;;;;;;;;;;;;;;;;;;;;;;;;;;;;;;;;;;;;;;;;;;;;;;;;;;;;;;;;;;;;;;
