Frango-d'água-comum;Gallinula galeata;(Lichtenstein, 1818);Common Gallinule;Pouco Preocupante;;Caminha sobre a vegetação mais densa, caçando invertebrados, ocasionais pequenos vertebrados, embora sua alimentação principal seja de origem vegetal.;;O frango-d'água-comum é uma ave gruiforme da família Rallidae. Ave aquática das mais comuns em várias partes do Brasil, escasseia na floresta Amazônica e, surpreendentemente, não é muito frequente no Pantanal. Conhecido também como galinhola (Rio Grande do Sul), jaçanã-galo (Nordeste), peituda (Rio de Janeiro) e galinha-d'água. Antigamente denominado Gallinula chloropus.;;"Seu nome científico significa: do (latim) gallinula = diminutivo de gallina = pequena galinha; e do (latim) galea, galeatus = elmo, capacete romano. ⇒ Pequena galinha com capacete.";Todo cinza escuro, ao longe parecendo negro, com uma série de linhas brancas, largas, abaixo da asa fechada. Sob a cauda, área branca. Na cabeça, um grande escudo frontal vermelho une-se à pele nua e vermelha da base do bico, o qual é amarelo e só a ponta é visível. Pernas e pés amarelados. Junto do corpo, a perna é avermelhada. Sua vocalização é um agudo “kürrrk”, estridulante “ki-ki”.;ESPÉCIE SEM DIMORFISMO SEXUAL;;;;;;;;;;;;Possui sete subespécies reconhecidas:;;;;;;;;;;;;;Alimentando-se de pétalas;Alimentando-se de vegetação aquática;Alimentando-se de gramíneas;Alimentando-se de peixe;Os ninhos são construídos na vegetação do interior do brejo, nas suas margens ou em grandes plataformas flutuantes, feitas de vegetação aquática. O sistema reprodutivo varia de casais, dois machos para uma fêmea ou o inverso. Algumas vezes, coloca seus ovos nos ninhos de outras galinholas, deixando para os pais adotivos o trabalho de criar os filhotes. É territorial no período reprodutivo, aceitando outras galinholas próximas fora dessa época. O ninho é exposto ou semiexposto, elaborado, sobre a água, construído de 6 a 8 dias. A postura é de 9 ovos, de coloração esverdeada com pintas castanhas claras e escuras, distribuídas por toda a superfície. O período de incubação é de 19 a 22 dias. Os filhotes permanecem no ninho de 1 a 2 dias (de La Peña, 2005).;É comum em lagos com vegetação aquática e margens pantanosas. Normalmente é visto nadando próximo às margens, quando balança a cabeça para frente e para trás. Esconde-se na vegetação pantanosa, se assustado. Nada muito bem, afastando-se do perigo dessa forma. Assustado, pode tentar voar de uma forma desengonçada, correndo na superfície da água com ajuda das asas. Apesar dessa performance pouco convincente, é uma voadora excelente, dispersando-se à noite e aparecendo em açudes ou lagoas onde não existia.;gavião-caboclo (Heterospizias meridionalis);savacu (Nycticorax nycticorax);jacurutu (Bubo virginianus);Presente em todo o Brasil e em quase todo o continente americano, onde é encontrado desde o norte do Canadá até o Chile, Uruguai e Argentina. Também ocorre nas ilhas do Caribe. Os bandos que habitam as regiões mais frias do norte do continente americano migram para o sul durante o inverno daquela região.;;;;;;;;;;;;;;;;;;;;;;;;;;;;;;;;;;;;;;;;;;;;;;;;;;;;;;;;;;;;;;;;;;;;;;;;;;;;;;;;;;
Quero-quero;Vanellus chilensis;(Molina, 1782);Southern Lapwing;Pouco Preocupante;Mede 37 centímetros de comprimento e pesa cerca de 277 gramas.;O quero-quero se alimenta de invertebrados aquáticos e peixinhos que encontra na lama. Para capturá-los, ele agita a lama com as patas para provocar a fuga de suas presas. Também se alimenta de artrópodes e moluscos terrestres.;;O quero-quero, quem-quem, espanta-boiada, tetéu, xexéu ou também conhecido como abibe-do-sul é uma ave da ordem Charadriiformes da família Charadriidae.;;;;;;;;;;;;;;;"Seu nome científico significa: do (latim) vanellus = diminutivo de vannus = abibe, (nome popular de uma ave passeriforme que habita Portugal); e chilensis = referente ao pais do Chile, originário do Chile. ⇒ Pequena Abibe do Chile ou abibe-do-sul chilense.";;Possui um esporão pontudo, ósseo, com 1 centímetro de comprimento no encontro das asas, uma faixa preta desde o pescoço ao peito e ainda umas penas longas (penacho) na região posterior da cabeça, tem um desenho chamativo de preto, branco e cinzento na plumagem. A íris e as pernas são avermelhadas. O esporão é exibido a rivais ou inimigos com um alçar de asa ou durante o voo.;ESPÉCIE SEM DIMORFISMO SEXUAL;;;;quero-quero (Vanellus chilensis) exibindo o esporão para a rival.;Possui quatro subespécies reconhecidas:;;;;;;;;;;;;;;;;;quero-quero se alimentando;"Na primavera, a fêmea põe normalmente de três a quatro ovos. Nidifica em uma cavidade esgravatada no solo; os ovos têm formato de pião ou pera, forma adequada para rolarem ao redor de seu próprio eixo e não lateralmente, sendo manchados, confundindo-se perfeitamente com o solo. Quando os adultos são espantados do ninho, fingem-se de feridos a fim de desviar dali o inimigo; o macho torna-se agressivo até mesmo a um homem. Os filhotes são nidífugos, capazes de abandonar o ninho quase que imediatamente após o descascamento do ovo.";"Costuma viver em banhados e pastagens; é visto em estradas, campos de futebol e próximo a fazendas, frequentemente longe d'água. O quero-quero é sempre o primeiro a dar o alarme quando algum intruso invade seus domínios. É uma ave briguenta que provoca rixa com qualquer outra espécie habitante da mesma campina. As capivaras tiram bom proveito da convivência com o quero-quero, pois, conforme a entonação, o grito dessa ave pode significar perigo. Então os grandes roedores procuram refúgio na água.";Essa característica faz do quero-quero um excelente animal de guarda, sendo utilizado por algumas empresas que possuem seu parque fabril populado por estas aves.;carcará (Caracara plancus);chimango (Milvago chimango);gavião-caboclo (Heterospizias meridionalis);gavião-de-rabo-branco (Geranoaetus albicaudatus);gavião-do-banhado (Circus buffoni);Sucuri (Eunectes murinus);O quero-quero é uma ave típica da América do Sul, sendo encontrado desde a Argentina e leste da Bolívia até a margem direita do baixo Amazonas e principalmente no Rio Grande do Sul, no Brasil. Habita as grandes campinas úmidas e os espraiados dos rios e lagoas.;;;;;;;;;;;;;;;;;;;;;;;;;;;;;;;;;;;;;;;;;;;;;;;;;;;;;;;;;;;;;;;;;;;;;;
Maçarico-solitário;Tringa solitaria;Wilson, 1813;Solitary Sandpiper;Pouco Preocupante;O maçarico-solitário é uma ave de porte médio e mede cerca de 19 centímetros de comprimento, com uma envergadura entre 38 e 41 centímetros, pesam entre 31 e 65 gramas sendo as fêmeas maiores.;Alimenta-se de pequenos invertebrados que encontra sob a água rasa.Atento, tem o hábito de correr nas margens de lagos e alagadiços assim que percebe alguma presa.;;O maçarico-solitário (Tringa solitaria) é uma ave charadriiforme da família Scolopacidae.;;"Seu nome científico significa: do (grego) trungas = pássaro branco que sacode a cauda mencionado por Aristóteles sem ser completamente identificado, mas tomado por autores posteriores como sendo um maçarico ou alvéola; e do (latim) solitária, solus = solitária, solitário, só. ⇒ Maçarico solitário.";;Ele tem um longo bico fino e pontudo, longas pernas esverdeados, um pescoço fino de tamanho médio, suas costas, asas e cabeça são de coloração cinza esverdeada, e as asas são marcadas com pintas brancas. Ele tem uma cauda barrada com uma linha escura no centro cruzado por barras com aparência de espinha de peixe. Uma cabeça pequena com um anel periocular branco circundando grandes olhos escuros.;Machos e fêmeas são parecidos, mas as fêmeas são maiores que os machos.;;;Possui duas subespécies reconhecidas:;;;;;;;;;No quadro abaixo apresenta-se a relação de comprimento entre o bico e a cabeça, assim como a relação de comprimento entre o bico e o tarso dos três maçaricos mais comuns do gênero Tringa: maçarico-solitário (Tringa solitaria), maçarico-de-perna-amarela (Tringa flavipes) e maçarico-grande-de-perna-amarela (Tringa melanoleuca);O bico do maçarico-solitário é reto ou apenas curvado para baixo e relativamente mais robusto que o bico do maçarico-de-perna-amarela que é reto e fino. O longo bico do maçarico-grande-de-perna-amarela é reto ou apenas curvado para cima.;As caudas do maçarico-de-perna-amarela e do maçarico-grande-de-perna-amarela são muito parecidas entre elas. São finamente barradas e o uropígio é branco, enquanto o maçarico-solitário tem uma linha escura que divide o uropígio, cruzado por barras (espinha de peixe).;Diferenças entre o maçarico-solitário (Tringa solitaria) e o maçarico-de-perna-amarela (Tringa flavipes).;maçarico-solitário ao fundo e maçarico-de-perna-amarela na frente;;maçarico-solitário se alimentando;Ave migratória visitante do hemisfério norte. Habita locais à beira d'água doce, margens lamacentas de rios e lagos, poças de chuva maiores, especialmente quando localizadas em campos com árvores. Normalmente encontrado solitário, às vezes em 2 ou 3 indivíduos espalhados, mas nunca em grupos.;Todo o continente americano. Reproduz-se na América do Norte, migrando durante o inverno para a região compreendida entre o México e a Argentina, incluindo todas as regiões do Brasil. Sua presença em nosso País é, portanto, temporária.;;;;;;;;;;;;;;;;;;;;;;;;;;;;;;;;;;;;;;;;;;;;;;;;;;;;;;;;;;;;;;;;;;;;;;;;;;;;;;;;;;;;;;;;;;;;;;;
Jaçanã;Jacana jacana;(Linnaeus, 1766);Wattled Jacana;Pouco Preocupante;Medem cerca de 23 cm de comprimento, possuindo plumagem negra com manto castanho, bico amarelo com escudo frontal vermelho, rêmiges verde-amareladas, encontro com um afiado esporão vermelho. Sua plumagem juvenil é toda branca embaixo, com as costas marrom acinzentado e parte superior do pescoço e cabeça escuros. Uma listra branca inicia-se sobre os olhos e estende-se pela nuca e parte de trás do pescoço. As longas penas das asas amarelas, como no adulto, formam a única característica comum entre as duas plumagens. Parecem pertencer a outra espécie.;Nas plantas, ou logo abaixo delas, encontra os insetos e outros invertebrados de sua alimentação. Come também grãos.;;O jaçanã (Jacana jacana), do tupi ñaha´nã, é uma ave que ocorre na América do Sul, charadriiforme, da família dos Jacanidae.;;Também são conhecidas pelos nomes de aguapeaçoca, cafezinho, casaca-de-couro, ferrão, japiaçó, japiaçoca, marrequinha, menininho-do-banhado, nhaçanã, nhançanã, nhanjaçanã, piaçó, piaçoca, pia-sol e narceja. Em certas regiões do sul do Brasil é também conhecida por asa-de-seda.;Dá nome a um bairro famoso da cidade de São Paulo, eternizado na canção “Trem das onze” de Adoniram Barbosa. Em certos lugares da África e da Austrália, as espécies de jaçanã são conhecidas como “Jesus bird”, porque parecem andar em cima da água!;Seu nome científico significa: do (tupi) yassãnã, yahãnã = pássaro muito alerta, pássaro muito barulhento. ⇒ Pássaro muito alerta ou pássaro muito barulhento.;Uma das aves mais comuns nos brejos e margens de rios, possui os pés enormes para seu tamanho. Além de ter os dedos longos e finos, também as unhas são muito compridas. No dedo que fica para trás, a unha é mais longa do que o próprio dedo. Esse arranjo possibilita suas caminhadas sobre as plantas aquáticas, dividindo o peso do corpo em uma larga base. Anda e corre pelas folhas das plantas boiando como se estivesse em chão seco.;;ESPÉCIE SEM DIMORFISMO SEXUAL;;;Possui seis subespécies:;;;;;;;;jaçanã se alimentando;Vive aos casais ou em pequenos grupos, sendo a fêmea maior do que o macho. Em alguns locais, as fêmeas montam pequenos haréns de machos, os quais tomam conta dos ninhos. Os ovos ficam em estruturas formadas por talos de plantas aquáticas, flutuantes. Durante 28 dias são chocados os 4 ovos da postura, sendo papel masculino todo o trabalho de criação. Se alguma fêmea que não seja a esposa do macho aparecer, vai estraçalhar os ovos enquanto o macho só fica olhando, por causa de amnésia, acaba acasalando com ela no final. Os filhotes recém-nascidos andam sobre a vegetação no primeiro dia após nascerem e logo perdem a penugem branca da barriga e castanha das costas.;Embora sejam relativamente sociáveis em alguns locais ou épocas do ano, defendem seus territórios contra outras jaçanãs (ou cafezinhos, nome pantaneiro). As fêmeas são particularmente agressivas. Nessas ocasiões voam diretamente para o intruso, emitindo seu peculiar chamado, como uma risada fina e longa. Ao pousarem, para intimidar o invasor, mantêm as asas abertas e esticadas para o alto, destacando as penas longas, amarelas, das asas. Nessa postura, aparece o esporão amarelo do encontro das asas. Através dessas atitudes, intimidam a ave invasora. Ocasionalmente, ocorre luta corporal.;falcão-peregrino (Falco peregrinus);gavião-do-banhado (Circus buffoni);gavião-cinza (Circus cinereus);jaçanã (Jacana jacana);A jaçanã (Jacana jacana Linnaeus, 1766) tem vasta distribuição nas Américas, ocorrendo a partir das Guianas até a Venezuela, Colômbia, Brasil, Bolívia, Argentina, Equador, Peru e Chile (Meyer de Schauensee 1982).;;;;;;;;;;;;;;;;;;;;;;;;;;;;;;;;;;;;;;;;;;;;;;;;;;;;;;;;;;;;;;;;;;;;;;;;;;;;;;;;;;;;;;;;;;;;;;;
Rolinha-roxa;Columbina talpacoti;(Temminck, 1810);Ruddy Ground-Dove;Pouco Preocupante;Mede 12-18 centímetros de comprimento e pesa cerca de 35-56 gramas.;Alimenta-se de grãos encontrados no chão. Havendo alimento, reproduz-se o ano inteiro. Costuma frequentar comedouros com sementes e quirera de milho.;;Historicamente uma das primeiras espécies brasileiras a se adaptar ao meio urbano, ainda é a espécie nativa mais comum em boa parte das grandes cidades brasileiras. É curioso notar que costuma ser encontrada em maior quantidade em locais alterados pelo homem do que em seu próprio habitat original que são as áreas de cerrados e campos.;;Conhecida também como rolinha-barreirinha, rola-caldo-de-feijão, rolinha-caldo-de-feijão (Paraíba e Ceará), sangue-de-boi (Piauí), picuí-peão, rola, pomba-rola, rola-grande, rola-roxa, rola-sangue-de-boi (Pernambuco e Bahia), rolinha-comum, rolinha-vermelha, rolinha-juruti, rolinha-roxa e pomba-café. Em várias áreas do Nordeste do Brasil o nome “rolinha-vermelha” é usado tanto para se referir a Columbina talpacoti e a fêmea da pararu-azul Claravis pretiosa e, portanto, sugere-se que este nome popular seja evitado. A sua vocalização é uma sequencia de “uú-uú-uú”.;;;;;;;;;;;;;;;"Seu nome científico significa: do (latim) columbina = referente à família Columbidae; e do (tupi) talpacoti = nome indígena para este pássaro (obs: não confirmado em Garcia (1929) Columbina). ⇒ Pombinha talpacoti.";;O macho, com penas marrom avermelhadas, cor dominante no corpo do adulto, em contraste com a cabeça, cinza azulada. A fêmea é toda parda. Nos dois sexos, sobre a asa há uma série de pontos negros nas penas. Os filhotes saem com traços da plumagem de cada sexo.;;;;Possui 4 subespécies, sendo que apenas uma ocorre no Brasil:;;;;;;;O casal mantém um território de ninho, afastando as outras rolinhas de perto. O macho possui um canto monótono, de dois chamados graves e rápidos, repetidos continuamente por vários segundos. Os ninhos são pequenas tigelas de ramos e gravetos, feitos entre cipós ou galhos, bem fechados pelas ramadas do entorno. Postura de 2 ovos, chocados pelo casal entre 11 e 13 dias. Os filhotes saem do ninho com no máximo 2 semanas de vida. O casal, às vezes dois dias depois, já inicia nova ninhada, quando as condições ambientais permitem.Os ninhos são construídos em árvores baixas e altas e as vezes em cachos de banana ou em calhas das casas e nos telhados.;"Adapta-se aos ambientes artificiais criados pela ação humana. Vive em áreas abertas; o desmatamento facilitou sua expansão, em especial nas áreas formadas para pasto ou agricultura de grãos. Entrou nas grandes cidades das regiões sudeste e centro-oeste do Brasil.";Muito agressivas entre si, embora possam formar grupos, disputam alimentos e defendem territórios usando uma das asas para dar forte pancadas no oponente. Os machos são mais belicosos. Nas disputas ou quando tomam sol, deitadas de lado no chão e com a asa esticada para cima, mostram a grande área de penas negras sob a asa.;Observadores de pássaros do centro-sul de nosso país vêm observando uma “substituição” desta espécie por outra pombinha, a Zenaida auriculata, também conhecida como pomba-de-bando, amargosinha ou avoante. Esta última espécie vem conquistando o ambiente urbano cada vez mais efetivamente e está aparentemente competindo com a rolinha, que já é menos frequente que a pomba-de-bando na maioria das cidades do interior de São Paulo.;Seja como for, esta espécie simpática e até mesmo ingênua está longe de desaparecer dos quintais de nossas casas e das praças e jardins de nossas cidades, mesmo que estes estejam em grandes prédios.;Bando de rolinha-roxa;anu-branco (Guira guira);caburé (Glaucidium brasilianum);falcão-de-coleira (Falco femoralis);garça-branca-grande (Ardea alba);gato-doméstico (Felis silvestris catus);gavião-miudinho (Accipiter superciliosus);gavião-miúdo (Accipiter striatus);gaviãozinho (Gampsonyx swainsonii);mico-estrela (Callithrix penicillata);murucututu (Pulsatrix perspicillata);quiriquiri (Falco sparverius);teiú (Salvator merianae);jiboia (Boa constrictor);Ocorre em todo o Brasil, porém raramente vista em áreas densamente florestadas da Amazônia.;;;;;;;;;;;;;;;;;;;;;;;;;;;;;;;;;;;;;;;;;;;;;;;;;;;;;;;;;;;;;;;;;;;;;;;
Asa-branca;Patagioenas picazuro;(Temminck, 1813);Picazuro Pigeon;Pouco Preocupante;;Alimenta-se de sementes e pequenos frutos geralmente coletados no solo. São granívoros e frugívoros, frequentando roças de milho e feijão, principalmente após a colheita.;;A pomba-asa-branca é uma ave columbiforme da família Columbidae. Conhecido pelos nomes populares de: asa-branca, legítima, ligiti ou pomba-ligiti (derivado popular de legítima), legítima-mineira, pomba-do-ar, pomba-trocal, pomba-trocaz, pomba-carijó (RS), pombão, milonga (Sul do Piauí) e pomba-verdadeira. Quando em voo, a principal característica da espécie é a faixa branca na parte superior das asas.;;;;;;;;;;;;;"Seu nome científico significa: do (grego) patageö = barulho, barulhento; e oinas = pomba; e do (guarani) pcázuró pomba amarga, amargosa. ⇒ Pombo barulhento e com sabor amargo. A referência amargosa, feita pelos nativos americanos, é em relação ao sabor da carne desta ave que se alimentava de frutos amargos. (Frisch, 2005).";Uma das maiores espécies da família no País. Cabeça e partes de baixo marrom vinho, barriga pálida. Penas da nuca branco-prateado com pontas pretas. Manto superior roxo metálico, pontas escuras. Costas na maior parte cinza escuro. Asas marrom apagado, cobertura das asas cinza com pontas pálidas. Cauda preta. Pele orbital vermelha. A fêmea tem cor mais pálido. Mede cerca de 34 centímetros de comprimento.;Canto baixo, profundo e rouco, de três a quatro sílabas: “gu-gu-gúu”, “gú-gu-gúu”, sendo que o macho emite quatro repetições e a fêmea três.;;;Possui duas subespécies reconhecidas:;;;;;;;;pomba-asa-branca se alimentando;"Nidifica em todos os meses do ano no sudeste do Brasil. Os casais fazem ninhos em territórios demarcados pelo macho em voos altos e com batimento especial das asas. Constrói o ninho em árvores e a cerca de 3 metros do solo ou na parte baixa de uma árvore de cerrado na borda de cerradão; o ninho é achatado com gravetos frouxamente entrelaçados. O material do ninho é quebrado dos ramos secos no topo de árvores ou pego no chão. As vezes reutiliza o mesmo ninho mais de 9 vezes quando feito em muros de casas (observação pessoal de Thiago Almeida, ano de 2020/2021) principalmente quando existe abundância de alimento próximo ao local. O único ovo, branco, é incubado por 16 a 19 dias pelo casal que também se ocupa da criação do filhote. O filhote é alimentado pelos pais com o “leite de papo ou de pombo”, massa queijosa composta pelo epitélio digestivo do papo, que é fortemente desenvolvido em ambos os sexos durante a época da criação. Essa substância é regurgitada para ser recolhida pelos filhotes nos bicos dos pais. À medida que os filhotes vão crescendo são adicionadas sementes em ordem crescentes. O filhote saindo do ninho é semelhante aos pais, um pouco menor e com a faixa branca da asa quase inexistente. Após o período reprodutivo associa-se em bandos, executando migrações.";A pomba-galega (P. cayennensis) pode por vezes cruzar com a pomba-asa-branca (P. picazuro), gerando híbrido (Crozariol & Indiani 2010).;Casal de pomba-asa-branca;Ninho de pomba-asa-branca;Ovo de pomba-asa-branca;Filhote de pomba-asa-branca;"Vive nos campos com árvores, áreas urbanas, cerrados, caatingas e florestas de galeria. Frequentemente encontrada no solo. É migratória como outras pombas, estendendo seus domínios acompanhando o desmatamento, aparecendo em grande quantidade. Voa longas distâncias e a grandes altitudes, exibindo seu espelho alar branco; está aproveitando as áreas urbanas, é comum ser encontrada comendo milho em galinheiros.";Bando de pomba-asa-branca;carcará (Caracara plancus);gavião-de-rabo-branco (Geranoaetus albicaudatus);coruja-buraqueira (Athene cunicularia);gavião-carijó (Rupornis magnirostris);jiboia (Boa constrictor);mico-estrela-de-tufos-pretos (Callithrix penicillata);Ocorre do Nordeste ao Rio Grande do Sul, Goiás, Mato Grosso, São Paulo (nas partes meridionais do país) e também na Bolívia, Argentina e Paraguai.;Status de conservação: LC ( IUCN );  Ocorrências registradas no WikiAves;FUNDEVAP - disponível em http://www.fundevap.org.br/Downloads/Ornitologia/Patagioenas-picazuro_Asa-branca.pdf Acesso em 03 mai. 2009.;Disponível em: http://www.diagnostico.org.br/especies/Columba-picazuro Acesso em 03 mai. 2009.;CEO - disponível em http://www.ceo.org.br/musica/asa%20branca.htm Acesso em 28 jun. 2009.;Crozariol, M.A. & J. Indiani (2010) Um híbrido entre a pomba-galega (Patagioenas cayennensis) e pombão (Patagioenas picazuro) (Columbiformes: Columbidae). Atualidades Ornitológicas 153- 6-7.;Sick, Helmut. Ornitologia Brasileira.;SIGRIST, T. Aves do Brasil: Uma Visão Artística, São Paulo: Editora Avis Brasilis, 2004.;"FRISCH, Johan Dalgas; FRISCH, Christian Dalgas. Aves Brasileiras e Plantas que as Atraem, São Paulo: Dalgas Ecoltec - Ecologia Técnica Ltda, 3ª Edição, 2005.";http://avibase.bsc-eoc.org/species.jsp?lang=EN&avibaseid=C7405D19458E798A - Acesso em 30/01/2014.;Consulta bibliográfica sobre as subespécies:;"CLEMENTS, J. F., T. S. Schulenberg, M. J. Iliff, D. Roberson, T. A. Fredericks, B. L. Sullivan, and C. L.. The Clements checklist of Birds of the World: Version 6.9; Cornell: Cornell University Press, 2014.";"del Hoyo, J.; et al., (2014). Handbook of the Birds of the World Alive. Lynx Edicions, Barcelona.";"ITIS - Integrated Taxonomic Information System (2015); Smithsonian Institution; Washington, DC.";Piacentini et al. (2015). Annotated checklist of the birds of Brazil by the Brazilian Ornithological Records Committee / Lista comentada das aves do Brasil pelo Comitê Brasileiro de Registros Ornitológicos. Revista Brasileira de Ornitologia, 23(2): 91–298.;"The World Bird Database, AVIBASE; http://avibase.bsc-eoc.org/species.jsp?avibaseid=C7405D19458E798A";;;;;;;;;;;;;;;;;;;;;;;;;;;;;;;;;;;;;;;;;;;;;;;;;;;;;;;;;;;;;;;
