corruira;Troglodytes musculus;Naumann, 1823;Southern House Wren;Corruíra;Mede de 10-13 centímetros de comprimento, e pesa em torno de 10-12 g. É grande cantadora e seu canto trinado, alegre e melodioso, é ouvido principalmente no começo da manhã. Enquanto ela se move sobre construções ou na vegetação, emite sem parar um crét crét, rouco e baixo. Bem pequena, pode ser escondida na palma da mão. É parente do famoso uirapuru, considerado por muitos como a ave brasileira que tem o canto mais bonito.;Come insetos pequenos (besouros, cigarrinhas, formigas, lagartas, vespinhas) e pequenas aranhas, e às vezes até filhotes de lagartixa. Captura as presas enfiando o bico em frestas e cavidades, tanto em construções humanas quanto sob a casca de plantas.;;É quase inconfundível, ao menos em ambientes alterados pelo homem, pois as outras espécies brasileiras da família Troglodytidae são típicas de ambientes florestais ou restritas a habitats muito específicos.;;Até recentemente a espécie Troglodytes aedon tinha sua distribuição registrada em todo o continente americano, exceto acima do Círculo Polar Ártico, no entanto após uma série de estudos, as populações ao sul do México passaram a ser consideradas como uma espécie distinta, renomeada como Troglodytes musculus. Muito comum, ocorre virtualmente em todos os habitats abertos e semiabertos, aparecendo rapidamente em clareiras abertas em regiões florestadas. Habita também os arredores de casas e jardins, inclusive no centro de cidades, e ocupa ilhas na costa marítima, cerrados, a caatinga, borda de matas e margens de banhados.;"Seu nome científico significa: do (grego) Troglodytes = aquele que mora em cavernas; (latim) musculus diminutivo de mus = pequeno rato; camundongo.⇒ Pequeno rato que habita as cavernas.";;ESPÉCIE SEM DIMORFISMO SEXUAL;corruíra adulto;corruíra jovem;Possui dezoito subespécies reconhecidas:;;;;;;;;;;;;;;;;;;;;;;;;;Por alimentar-se de pequenos insetos que procura entre a folhagem baixa e em todo lugar escondido nos cantos dos jardins, recebeu o nome científico de musculus, que significa rato, já que dá a impressão de ser um camundongo, quando está saltitando pelos cantos.;corruíra se alimentando;Faz seu ninho em todo tipo de cavidade, o que motivou também o nome do gênero Troglodytes, que significa morador da caverna. Com certeza os comportamentos mais notáveis em relação a esta espécie referem-se a sua reprodução, pois a corruíra é capaz de construir seu ninho nos locais mais improváveis. A lista de relatos de ninhos construídos em condições incomuns é grande, passando por telefones públicos, tratores, caixas de música, instalações elétricas, etc. É uma das aves que mais se aproveita dos ninhos artificiais disponibilizados pelos humanos, especialmente caixas com entrada pequena. Nidifica em qualquer cavidade, como troncos de árvores ocas, embaixo de telhas de casas ou em ninhos de outras aves. Os ninhos são constituídos principalmente por gravetos entrelaçados com no máximo 18 centímetros e mínimo 1,7 centímetro. Apresentam folhas, raízes, sementes e diversos materiais industrializados como pregos, metais, papel, plástico e tecido. No local em que são depositados os ovos (câmara), ocorre o revestimento de penas de outras aves, pelos, provavelmente de bovino, suíno e equino, e grande quantidade de cabelos humanos.;Os ovos, de 3 a 6, vermelho-claros, densamente salpicados de vermelho-escuro, com manchas cinza-claras, eclodem após cerca de duas semanas e os filhotes demoram quase o dobro deste tempo para abandonar o ninho. Os pais se revezam nos cuidados com os filhotes.;Observação pessoal (Amanda Perin Marcon): Em meados de setembro e outubro de 2014, observei um casal com seus dois filhotes vindo todos os finais de tarde a um ninho artificial que tenho pendurado na sacada. Sempre barulhentos, entravam e saíam várias vezes até, finalmente, ficarem todos lá dentro. Passavam a noite e cedo da manhã já começavam novamente a se agitar para saírem. Fizeram isso diariamente por cerca de um mês, sempre vindo no mesmo horário do dia. Ainda em meados de janeiro a família aparecia em alguns dias intercalados, mas depois não vieram mais. Em 2015, nos mesmos meses do ano, aconteceu o mesmo. Provavelmente é o mesmo casal com uma prole nova. À noite, cerca de 21h, testei me aproximar para ver se eles se afugentariam. Fiquei ao lado deles e até segurei o ninho nas mãos, mas não foram embora nem fizeram alarde, apenas ficaram me observando. Não verifiquei nenhuma postura ou alimentação aos filhotes no meio tempo em que estavam ocupando o ninho artificial, o que indica que eles vieram apenas para passar a noite em um local seguro, longe de predadores.;"A corruíra pode destruir ovos de outras espécies de aves sem nem mesmo alimentar-se deles. Este comportamento pode estar relacionado à eliminação de competidores de outras espécies. Há vários relatos deste comportamento para a espécie americana, e para a brasileira há uma descrição de predação em ovos do sabiá-barranco (Turdus leucomelas). Vive solitária ou aos pares; macho e fêmea cantam em dueto. É encontrada em bordas de matas, cerrados, caatingas, áreas alagadas, campos e áreas verdes urbanas próximas a residências. Esta espécie se assemelha a um camundongo por ter a característica de pular enquanto se locomove pelo chão, por cima de galhos úmidos e por cima de entulhos de construção.";É muito interessante se olhar para essa ave como se fosse uma “aventureira”, pois parece que gosta de explorar as coisas quando se enfia em buracos ou áreas mais escuras da mata. Além disso, ela é capaz de escalar superfícies verticais, como muros e troncos de árvores, como fazem os pica-paus.;quiriquiri (Falco sparverius);Corredeira (Philodryas nattereri);Possui ampla distribuição, ocorrendo desde o Canadá até o sul da Argentina, Chile e em todo o Brasil.;  Ocorrências registradas no WikiAves;FUNDEVAP - Disponível em http://www.fundevap.org.br/Downloads/Ornitologia/Troglodytes-musculus_Corruira.pdf Acesso em 26 abr. 2009.;CEO - Disponível em: http://www.ceo.org.br/especies/Troglodytes_musculus.htm Acesso em 26 abr. 2009.;SANTIAGO, R. G. Corruira ou Cambaxirra ( Troglodytes (aedon) musculus ) Biblioteca Digital de Ciências, 20 feb. 2007. Disponível em: <http://www.ib.unicamp.br/lte/bdc/visualizarMaterial.php?idMaterial=416>. Acesso em: 26 abr. 2009.;Portal Brasil 500 pássaros, Corruíra. Disponível em: http://webserver.eln.gov.br/Pass500/BIRDS/1eye.htm. Acessado em 10 mai. 2009.;"CLEMENTS, J. F.; The Clements Checklist of Birds of the World. Cornell: Cornell University Press, 2005.";;;;;;;;;;;;;;;;;;;;;;;;;;;;;;;;;;;;;;;;;;;;;;;;;;;;;;;;;;;;;;;;;;;;;;;;
sabia-una;Turdus flavipes;Vieillot, 1818;Yellow-legged Thrush;Pouco Preocupante;Mede cerca de 20,5 centímetros de comprimento. O macho da espécie pesa cerca de 64 gramas e a fêmea 72 gramas.;Onívoro. Aprecia os frutos de magnólia-amarela (Michelia champaca), também aprecia frutos de palmitos, abacate e mamão. Frequenta comedor, a fêmea domina o mesmo e não deixa que outras aves se aproximem (Assim observei no inverno de Santa Catarina).;;O sabiá-una é uma ave passeriforme da família Turdidae. É conhecido também como sabiá-preta e sabiá-da-mata a fêmea é conhecida como sabiá-preto (Santa Catarina).;;"Seu nome científico significa: do (latim) Turdus = tordo; e flavus = amarelo; e do (grego) pes = pés - Tordo que tem os pés amarelos.";;"O macho é preto com as costas e barriga de coloração cinza; a fêmea é marrom-oliváceo nas partes superiores e marrom-amarelado nas partes inferiores, com a garganta estriada de marrom-escuro.";Seu canto é variado, rico em motivos dos mais diversos e de duração diferente. Capaz de imitar outras aves.;;;;Possui cinco subespécies:;;;;;;;;;;;;;;sabiá-una se alimentando;Atinge a maturidade sexual aos 12 meses. Faz um ninho raso em formato de xícara. Cada ninhada geralmente tem entre 2 e 3 ovos azulados ou esverdeados com marcas marrom-avermelhadas, tendo de 3 a 4 ninhadas por temporada. Os filhotes nascem após 13 dias.;Vive na mata, em regiões montanhosas. É comum na copa e nas bordas de florestas, capoeiras, clareiras adjacentes e em plantações de café. Em regiões montanhosas da costa brasileira é geralmente a espécie de sabiá mais comum. Vive solitário ou aos pares. É difícil de observar, a não ser quando está se alimentando em árvores frutíferas. Canta normalmente do alto das árvores. Além do próprio canto, imita uma série de outras aves, porém, às vezes, de forma tão grosseira que é difícil distinguir qual pássaro está imitando. Migra durante o inverno, deixando as regiões serranas em busca de lugares mais quentes.;Essa espécie ainda efetua grandes migrações no inverno, principalmente na região do rio Ribeira de Iguape, em Iguape (SP), até à faixa serrana de Santa Catarina. Aproveitando-se disso, muitos habitantes dessas áreas capturam milhares dessas aves para alimento, todos os anos. Até há alguns anos, essa aves eram tradicionalmente vendidas salgadas, em caixotes ou barricas, nas feiras e pequenos mercados de Iguape e região.;São capturados facilmente na migração, por meio de redes armadas à média e baixa altura, atravessadas em picadas ou sobre o leito de pequenos riachos na mata. Eu próprio presenciei na áreas de Iguape e Icapara (SP), nos anos 90, a coleta de sabiás-una feita pelas mulheres de caiçaras, que usavam pequenas tarrafas de pesca, amarradas em duas varas. Elas se posicionavam à beira das picadas, e em pouco tempo traziam dezenas de aves em samburás. Apesar de anti-ecológica, tal caça era totalmente aproveitada como alimento, principalmente pelas crianças caiçaras.;caburé-miudinho (Glaucidium minutissimum) predando filhote de Sabiá-una;Presente em Roraima e da Paraíba ao Rio Grande do Sul. Encontrado também na Colômbia, Venezuela, Guiana, Paraguai e Argentina.;;;;;;;;;;;;;;;;;;;;;;;;;;;;;;;;;;;;;;;;;;;;;;;;;;;;;;;;;;;;;;;;;;;;;;;;;;;;;;;;;;;;;;;;;;;
sabia-barranco;Turdus leucomelas;Vieillot, 1818;Pale-breasted Thrush;Pouco Preocupante;O juvenil tem o dorso pintalgado de bolas amarronzadas, sem a garganta branca bem delimitada. Pontos marrons no peito e barriga. Mede cerca de 22 a 23 centímetros. Não apresenta dimorfismo sexual, sendo sua diferenciação feita apenas pelo canto, que é característica dos machos.;Alimenta-se basicamente de minhocas e artrópodes. Assim como outros sabiás, revira as folhas caídas em busca de pequenos invertebrados e também se alimenta de pequenos frutos. Aprecia os frutos do tapiá ou tanheiro (Alchornea glandulosa). Costuma frequentar comedouros com frutas. Gosta de frutas tropicais, como a banana.;;O sabiá-barranco é o sabiá mais comum do interior do Brasil, especialmente em regiões de cerrado. Também chamado de sabiá-barranqueira, capoeirão, sabiá-de-cabeça-cinza, sabiá-fogueteiro, sabiá-branco, e sabiá-pardo. É uma ave passeriforme da família Turdidae, um pouco menor do que o sabiá-da-mata e o sabiá-laranjeira. Pode ser confundido com o sabiá-poca. Espécie semiflorestal. Vive à beira de matas, parques, matas de galeria, coqueirais e cafezais.;;"Seu nome científico significa: do (latim) Turdus = Tordo; e do (grego) leukos = branco; e melas = preto, leukomelas = mistura de branco e preto ou seja cinzento. ⇒ Tordo cinzento.";O adulto apresenta o alto da cabeça arredondado, acinzentada nos lados e olivácea na parte alta, sem a mácula negra à frente dos olhos. Bico cinza escuro uniforme. O tom acinzentado domina as costas, tornando-se amarronzado nas asas. Peito acinzentado, com a garganta branca e listras cinza escuro bem definidas. Quando voa, às vezes mostra a área alaranjada da parte interna das asas. A parte inferior da cauda é clara.;;;;;Possui três subespécies reconhecidas:;;;;;;;;;Foi observado na cidade de Jaú-SP um adulto alimentando-se do néctar das flores da paineira-vermelha ou paineira-da-índia (Observação:João Prado). No sudeste e norte do Brasil a espécie já foi avistada se alimentando de lagartixas e cobras-cegas.;sabiá-barranco se alimentando;Atinge a maturidade sexual aos 12 meses.;Residente, inicia sua reprodução em agosto e estende-a até dezembro. Como outros sabiás, constrói um ninho apoiado em galhos ou forquilhas, às vezes em alpendres e varandas de casas, usando uma mistura de barro, raízes e folhas na parte externa. Forma uma pequena torre e na parte superior fica a tigela funda de material vegetal mais macio. A fêmea choca de 2 a 4 ovos verde-azulados com salpicos pardos, que medem 28 por 20 milímetros e são incubados durante cerca de 12 dias, com os filhotes saindo do ninho em 17 dias. Por um tempo os filhotes costumam utilizar o ninho para dormir após já terem conseguido alçar voo em companhia dos pais. (Observação Pessoal, João de Almeida Prado).;A fêmea retira ou engole os sacos fecais dos filhotes nidícolas [T. Sigrist - Avifauna Brasileira, pg 253].;Costuma ter quatro ninhadas por temporada.;Comum em todas as matas ciliares, matas de galeria, matas secas, cambarazais e cerradões. Utiliza os capões de cerrado e cruza áreas abertas em voos diretos a meia altura. Acostuma-se com ambientes criados pela ação humana, como jardins, pomares e áreas urbanas bem arborizadas. Canta somente na primavera, época em que acasala. Adapta-se a diferentes ambientes e também é muito visto em parques urbanos com muita vegetação.;Sua voz é múltipla, com um canto contínuo, menos forte do que o de sabiá-laranjeira (Turdus rufiventris), composto de motivos relativamente simples, repetidos uma ou duas vezes. Durante o resto do ano só emite vocalizações de alerta, especialmente ao entardecer, quando disputa os melhores poleiros para passar a noite. Costuma ser o pássaro que emite o alerta mais forte em situações de “mobbing”, denunciando às outras aves a presença de um predador ou ameaça em potencial. É o pássaro que mais vocaliza em alerta perante Pulsatrix koeniswaldiana ( Observações pessoais de Henry Miller Alexandre ).;Canto;Chamado;Alerta;Jibóia (//Boa constrictor constrictor//);caburé (Glaucidium brasilianum);Cuíca-lanosa (//Caluromys philander//);Cobra-verde (//Philodryas olfersii//);araçari-banana (Pteroglossus bailloni);araçari-poca (Selenidera maculirostris);gavião-de-cauda-curta (Buteo brachyurus);Presente no Brasil todo.;  Ocorrências registradas no WikiAves;Ambiente Brasil - Disponível em: http://www.ambientebrasil.com.br/composer.php3?base=./especie/fauna/index.html&conteudo=./especie/fauna/aves/leucomelas.html Acesso em 25 abr. 2009.;WikiPédia - A Enciclopédia Livre - Disponível em: http://pt.wikipedia.org/wiki/Sabi%C3%A1-do-barranco Acesso em 25 abr. 2009.;SESC - Guia de Aves do Pantanal - Disponível em: http://www.avespantanal.com.br/paginas/265.htm Acesso em 25 abr. 2009.;SANTIAGO, R. G. Sabia-pardo ( Turdus leucomelas ) Guia Interativo de Aves Urbanas, 20 feb. 2007. Disponível em: <http://www.ib.unicamp.br/lte/giau/visualizarMaterial.php?idMaterial=425>. Acesso em: 25 apr. 2009.;Sazima, I. & D'Angelo, G. B. “The Pale-breasted Thrush (Turdus leucomelas) preys on a gekkonid lizard and an anomalepidid snake.” Revista Brasileira de Ornitologia (2011).;Federação Ornitológica de Minas Gerais: http://www.feomg.com.br/sab_barr.htm;Sick, Helmut. Ornitologia brasileira. Nova Fronteira, 1997.;Consulta bibliográfica sobre as subespécies:;"CLEMENTS, J. F., T. S. Schulenberg, M. J. Iliff, D. Roberson, T. A. Fredericks, B. L. Sullivan, and C. L.. The Clements checklist of Birds of the World: Version 6.9; Cornell: Cornell University Press, 2016.";"del Hoyo, J.; et al., (2016). Handbook of the Birds of the World Alive. Lynx Edicions, Barcelona.";Gill, F. & Wright, M. - IOC World Bird List 2017. Birds of the World - Recommended English Names. Princeton University Press, Princeton, N.J., and Oxford, UK.;;;;;;;;;;;;;;;;;;;;;;;;;;;;;;;;;;;;;;;;;;;;;;;;;;;;;;;;;;;;;;;;;;;;;;;;;
sabia-laranjeira;Turdus rufiventris;Vieillot, 1818;Rufous-bellied Thrush;Pouco Preocupante;Mede 20-25 centímetros de comprimento e o macho pesa 70 gramas e a fêmea, 80 gramas.;Sua nutrição se compõe basicamente de insetos, larvas, minhocas e frutas maduras, incluindo frutas cultivadas como o mamão, a laranja e o abacate. Come coquinhos de várias espécies de palmeiras e de espécies introduzidas, como o dendê. Cospe os caroços após cerca de 1 hora, contribuindo assim para a dispersão dessas palmeiras, comportamento apresentado também por outros sabiás. Ração de cachorro também atrai esta espécie, podendo servir de alimento em cidades grandes com menor disponibilidade de alimentos naturais. Aprecia os frutos do tapiá ou tanheiro (Alchornea glandulosa).;;Ave símbolo do estado de São Paulo, também considerada ave símbolo do Brasil (apesar de muitos contestarem alegando a ararajuba como a representante brasileira), o sabiá-laranjeira, também conhecido como sabiá-cavalo, sabiá-ponga, piranga, ponga, sabiá-coca, sabiá-de-barriga-vermelha, sabiá-gongá, sabiá-laranja, sabiá-piranga, sabiá-poca, sabiá-amarelo, sabiá-vermelho e sabiá-de-peito-roxo, é uma ave popular, citada por diversos poetas como o pássaro que canta na estação do amor, ou seja, na primavera. Foi imortalizado na “Canção do Exílio”, de Gonçalves Dias, juntou-se oficialmente aos outros quatro símbolos nacionais – a bandeira, o hino, o brasão de armas e o selo, passando a ter a mesma importância deles na representação do Brasil em 3 de outubro de 2002, por decreto do presidente Fernando Henrique Cardoso.;;;;;;;;;;;;;;;;;;;;;;;;;;;;;;;;;;;;;;;;;;;;;;;;;;;;;;;;;;;;;;;"Seu nome científico significa: do (latim) Turdus = tordo; e rufi, rufa; rufus = castanho, vermelho; em ornitologia rufus, rufa e rufum cobrem um amplo espectro de cores de amarelo, laranja, marrom, vermelho e roxo. e venter, ventris = ventre, barriga; - (Tordo com a barriga castanha).";;pesando em média de 68-80 gramas. Tem plumagem parda, com exceção da região do ventre, destacada pela cor vermelho-ferrugem, levemente alaranjada, e bico amarelo-escuro. Apresenta anel ocular amarelo vivo e garganta clara e escura estriada. Tarsos e pés rosa-cinzento.;É ave de canto muito apreciado, que se assemelha ao som de uma flauta. Canta principalmente ao alvorecer e à tarde. O canto serve para demarcar território e, no caso dos machos, para atrair a fêmea. A fêmea também canta, mas numa frequência bem menor que o macho. O canto do sabiá-laranjeira é parcialmente aprendido, havendo linhagens geográficas de tipos de canto, e se a ave conviver desde pequena com outras espécies, pode ser influenciada pelo canto delas e passar a ter um canto “impuro”. Além do belíssimo canto, a ave também usa de outros sons: o chamado comum é um “ga…ga-gá'-ca” lembrando uma galinha, geralmente seguido de assobios territoriais decrescentes e terminando em notas mais longas que no começo (fi-fi-fíu-fíu-fíu-fíu-fiúu-fiúúu). Tem canto de alvorecer também, canta nos horários de nascer do sol e pôr do sol (Tíu-wé , ou , Tiiêu-wah).;ESPÉCIE SEM DIMORFISMO SEXUAL;;;;;;;;;;;;;;;;;;;;;;;;;;;;;;;;;sabiá-laranjeira se alimentando;Pode fazer seu ninho em beirais de telhados. A construção de ninhos pode se tornar confusa em certas ocasiões: quando o local escolhido é formado por vãos entre numerosos suportes iguais de um telhado, o sabiá-laranjeira pode construir vários ninhos ao mesmo tempo, por confundir os vãos.;O ninho é feito entre setembro e janeiro, geralmente em arbustos, árvores de folhagem densa ou bananeiras, empregando fibras e gravetos ligados por um pouco de lama, num formato de tigela funda. Por dentro são revestidos de materiais mais macios como hastes de flores e capim. A fêmea choca até 3 vezes por ano, e em cada postura coloca de 3 a 4 ovos, de coloração verde-azulada com pintas (ou manchas) cor de ferrugem (sépia). O período de incubação dura em torno de 13 dias. Macho e fêmea se revezam na construção do ninho e na alimentação dos filhotes.;Casal de sabiá-laranjeira;Ninho de sabiá-laranjeira;Ovo de sabiá-laranjeira;Filhote de sabiá-laranjeira;É comum em bordas de florestas, parques, quintais e áreas urbanas arborizadas. Vive solitário ou aos pares, pulando no chão. Em regiões mais secas é, de certa forma, restrito a áreas próximas à água.;É uma ave que convive bem com ambientes modificados pelo homem, seja no campo ou na cidade, desde que tenha oportunidades de encontrar abrigo, alimento e água.;Na natureza, é encontrado em casais e grupos familiares quando em processo de criação. É uma ave de ambientes abertos, preferindo viver em bordas de matas, pomares, capoeiras, entorno de estradas, praças e quintais, sempre por perto de água abundante. É um pássaro territorial: demarca uma área geográfica quando está em processo de reprodução e não aceita a presença de outras aves da espécie. Começa a cantar antes mesmo de clarear o dia. O sabiá-laranjeira vive até 10 anos na natureza. Gosta de ficar em árvores fechadas e escuras, ou em árvores um pouco abertas.;Sobrevoa áreas alagadas de rios com aves territorialistas como o bem-te-vi e o suiriri, ela não suporta, e ataca-os. O Curutié também acompanha estes bandos mistos.;Bando de sabiá-laranjeira;coruja-orelhuda (Asio clamator);Cobra-verde (Philodryas olfersii);Presente do Maranhão ao Rio Grande do Sul, é o sabiá mais conhecido do Sudeste, sendo menos numeroso no Nordeste. Migra para regiões mais quentes no inverno. Encontrado também na Bolívia, Paraguai, Argentina e Uruguai.;  Ocorrências registradas no WikiAves;Wikipedia - A Enciclopédia livre - Disponível em: http://pt.wikipedia.org/wiki/Sabiá-laranjeira Acesso em 28 jan. 2014.;Portal Brasil 500 Pássaros, Sabiá-laranjeira - Disponível em: http://webserver.eln.gov.br/Pass500/BIRDS/1birds/p416.htm. Acesso em 04 mai. 2009.;Folha de São Paulo - Disponível em: http://www1.folha.uol.com.br/cotidiano/2013/09/1342434-cantoria-de-sabia-laranjeira-na-madrugada-divide-ouvidos-paulistanos.shtml. Acesso em 20 set. 2014.;GARCIA, R. 1929. Nomes de Aves em Língua Tupi. Boletim do Museu Nacional 5(3): 1-54;"CLEMENTS, J. F.; The Clements Checklist of Birds of the World. Cornell: Cornell University Press, 2014."
